[
  {
    "id": "men.w.truth-consequence-flame",
    "name": "Flamethrower",
    "type": "ranged",
    "rng": "SP8",
    "rof": 1,
    "pow": 12,
    "damageTypes": [
      "fire",
      "magical"
    ],
    "qualities": [
      "core.q.pistol",
      "core.q.magical"
    ],
    "abilities": [
      "men.a.continuous-fire"
    ],
    "text": "The flame half of Truth & Consequence: punch-blades with built-in flamethrowers."
  },
  {
    "id": "men.w.truth-consequence-blade",
    "name": "Truth & Consequence",
    "type": "melee",
    "rng": 1,
    "pow": 13,
    "qualities": [
      "core.q.magical"
    ],
    "abilities": [
      "men.a.continuous-fire"
    ]
  },
  {
    "id": "men.w.blazing-star",
    "name": "Blazing Star",
    "type": "melee",
    "rng": 2,
    "pow": 18,
    "location": "L",
    "abilities": [
      "men.a.chain-weapon",
      "men.a.thresher"
    ]
  },
  {
    "id": "men.w.flame-belcher",
    "name": "Flame Belcher",
    "type": "ranged",
    "rng": 10,
    "rof": 1,
    "aoe": 3,
    "pow": 15,
    "blastPow": 9,
    "location": "R",
    "damageTypes": [
      "fire"
    ],
    "abilities": [
      "men.a.continuous-fire"
    ]
  },
  {
    "id": "men.w.valeria-bow",
    "name": "Idrian Bow",
    "type": "ranged",
    "rng": 10,
    "rof": 1,
    "pow": 12,
    "abilities": [
      "men.a.armor-piercing-arrow",
      "men.a.featherweight-arrow",
      "men.a.incendiary-arrow",
      "men.a.incendiary-arrow-small"
    ],
    "text": "Each shot picks one arrow: armor-piercing, featherweight or incendiary."
  },
  {
    "id": "men.w.pyrrhus-spear",
    "name": "Spear & Shield",
    "type": "melee",
    "rng": 2,
    "pow": 13,
    "qualities": [
      "core.q.weapon-master",
      "core.q.shield",
      "core.q.magical"
    ],
    "abilities": [
      "men.a.continuous-fire",
      "cry.a.blessed"
    ]
  },
  {
    "id": "men.w.flame-spear",
    "name": "Spear",
    "type": "melee",
    "rng": 2,
    "pow": 12,
    "abilities": [
      "men.a.critical-fire"
    ]
  },
  {
    "id": "men.w.repulsor-shield",
    "name": "Repulsor Shield",
    "type": "melee",
    "rng": 1,
    "pow": 12,
    "location": "L",
    "qualities": [
      "core.q.shield"
    ],
    "abilities": [
      "men.a.repel"
    ],
    "text": "A shield that shoves back whatever it strikes or is struck by."
  },
  {
    "id": "men.w.light-immolator-flail",
    "name": "Flail",
    "type": "melee",
    "rng": 1,
    "pow": 14,
    "location": "R",
    "abilities": [
      "men.a.critical-fire",
      "men.a.chain"
    ],
    "text": "The Light Immolator arm: a chained fire flail."
  },
  {
    "id": "men.w.holy-flame-jet",
    "name": "Holy Flame Jet",
    "type": "ranged",
    "rng": "SP8",
    "rof": 1,
    "pow": 12,
    "damageTypes": [
      "fire",
      "magical"
    ],
    "qualities": [
      "core.q.pistol",
      "core.q.magical"
    ],
    "abilities": [
      "men.a.continuous-fire"
    ],
    "text": "A short spray of blessed fire from a hand projector."
  },
  {
    "id": "men.w.flame-halberd",
    "name": "Flame Halberd",
    "type": "melee",
    "rng": 2,
    "pow": 13,
    "qualities": [
      "core.q.weapon-master",
      "core.q.magical"
    ],
    "abilities": [
      "men.a.critical-fire"
    ],
    "text": "A blessed halberd that sets a foe alight on a critical hit."
  }
]
